{
  "schemaVersion": "2.0.0",
  "sessionId": "DISC-20260812-a1b2c3",
  "projectId": "example-product",
  "phase": "problem",
  "startedAt": "2026-08-12T12:00:00.000Z",
  "updatedAt": "2026-08-12T12:05:00.000Z",
  "turns": [
    {
      "at": "2026-08-12T12:05:00.000Z",
      "role": "agent",
      "summary": "Asked for problem context",
      "question": "Who experiences the problem today?"
    }
  ],
  "openQuestions": [
    "What is the measurable pain today?"
  ],
  "citations": [],
  "productCheckSnapshot": {
    "ok": false,
    "errors": [
      "docs/product/problem.md: unreplaced template placeholder remains"
    ]
  },
  "planningTier": "full"
}
